[
  {"label":"Source Sans Pro is Source Sans 3, renamed","entry":{"families":["Source Sans Pro"],"full":null,"postscript":null,"trusted":true},"patched":true,"owned":{"source-sans-3":"rename"},"not_owned":[],"near":[],"outcome":"owned"},
  {"label":"FiraCode NF is a patched Fira Code","entry":{"families":["FiraCode NF"],"full":null,"postscript":null,"trusted":true},"patched":true,"owned":{"fira-code":"patched"},"not_owned":[],"near":[],"outcome":"owned"},
  {"label":"FiraCode Nerd Font is a patched Fira Code","entry":{"families":["FiraCode Nerd Font"],"full":null,"postscript":null,"trusted":true},"patched":true,"owned":{"fira-code":"patched"},"not_owned":[],"near":[],"outcome":"owned"},
  {"label":"SauceCodePro Nerd Font is a patched Source Code Pro","entry":{"families":["SauceCodePro Nerd Font"],"full":null,"postscript":null,"trusted":true},"patched":true,"owned":{"source-code-pro":"patched"},"not_owned":[],"near":[],"outcome":"owned"},
  {"label":"FiraCode NF is only near Fira Code with patched builds off","entry":{"families":["FiraCode NF"],"full":null,"postscript":null,"trusted":true},"patched":false,"owned":{},"not_owned":["fira-code"],"near":["fira-code"],"outcome":"near"},
  {"label":"Roboto Slab is never Roboto","entry":{"families":["Roboto Slab"],"full":null,"postscript":null,"trusted":true},"patched":true,"owned":{"roboto-slab":"family"},"not_owned":["roboto"],"near":[],"outcome":"owned"},
  {"label":"Roboto Slab Bold in the registry is never Roboto","entry":{"families":[],"full":"Roboto Slab Bold","postscript":null,"trusted":false},"patched":true,"owned":{"roboto-slab":"family"},"not_owned":["roboto"],"near":[],"outcome":"owned"},
  {"label":"Inter Tight is never Inter","entry":{"families":["Inter Tight"],"full":null,"postscript":null,"trusted":true},"patched":true,"owned":{"inter-tight":"family"},"not_owned":["inter"],"near":[],"outcome":"owned"},
  {"label":"Inter Tight Bold in the registry is never Inter","entry":{"families":[],"full":"Inter Tight Bold","postscript":null,"trusted":false},"patched":true,"owned":{"inter-tight":"family"},"not_owned":["inter"],"near":[],"outcome":"owned"},
  {"label":"PostScript Inter-Tight-Bold is never Inter","entry":{"families":[],"full":null,"postscript":"Inter-Tight-Bold","trusted":false},"patched":true,"owned":{"inter-tight":"family"},"not_owned":["inter"],"near":[],"outcome":"owned"},
  {"label":"PostScript InterTight-Bold is never Inter","entry":{"families":[],"full":null,"postscript":"InterTight-Bold","trusted":false},"patched":true,"owned":{"inter-tight":"family"},"not_owned":["inter"],"near":[],"outcome":"owned"},
  {"label":"Noto Sans JP is never Noto Sans","entry":{"families":["Noto Sans JP"],"full":null,"postscript":null,"trusted":true},"patched":true,"owned":{},"not_owned":["noto-sans"],"near":[],"outcome":"ineligible"},
  {"label":"Noto Sans JP Bold in the registry is never Noto Sans","entry":{"families":[],"full":"Noto Sans JP Bold","postscript":null,"trusted":false},"patched":true,"owned":{},"not_owned":["noto-sans"],"near":[],"outcome":"ineligible"},
  {"label":"Noto Sans SC is never Noto Sans","entry":{"families":["Noto Sans SC"],"full":null,"postscript":null,"trusted":true},"patched":true,"owned":{},"not_owned":["noto-sans"],"near":[],"outcome":"ineligible"},
  {"label":"Noto Sans CJK SC is never Noto Sans","entry":{"families":["Noto Sans CJK SC"],"full":null,"postscript":null,"trusted":true},"patched":true,"owned":{},"not_owned":["noto-sans"],"near":[],"outcome":"ineligible"},
  {"label":"Source Han Sans SC is ineligible","entry":{"families":["Source Han Sans SC"],"full":null,"postscript":null,"trusted":true},"patched":true,"owned":{},"not_owned":[],"near":[],"outcome":"ineligible"},
  {"label":"Noto Sans CN (no such font) would be a CJK build of Noto Sans","entry":{"families":["Noto Sans CN"],"full":null,"postscript":null,"trusted":true},"patched":true,"owned":{"noto-sans":"patched"},"not_owned":[],"near":[],"outcome":"owned"},
  {"label":"Maple Mono CN is a CJK build of Maple Mono","entry":{"families":["Maple Mono CN"],"full":null,"postscript":null,"trusted":true},"patched":true,"owned":{"maple-mono":"patched"},"not_owned":[],"near":[],"outcome":"owned"},
  {"label":"Roboto Condensed is its own family","entry":{"families":["Roboto Condensed"],"full":null,"postscript":null,"trusted":true},"patched":true,"owned":{"roboto-condensed":"family"},"not_owned":["roboto"],"near":[],"outcome":"owned"},
  {"label":"Adwaita Sans is never Inter","entry":{"families":["Adwaita Sans"],"full":null,"postscript":null,"trusted":true},"patched":true,"owned":{"adwaita-sans":"family"},"not_owned":["inter"],"near":[],"outcome":"owned"},
  {"label":"Adwaita Sans Bold in the registry is never Inter","entry":{"families":[],"full":"Adwaita Sans Bold","postscript":null,"trusted":false},"patched":true,"owned":{"adwaita-sans":"family"},"not_owned":["inter"],"near":[],"outcome":"owned"},
  {"label":"Gentium Book, trusted, owns no Gentium","entry":{"families":["Gentium Book"],"full":null,"postscript":null,"trusted":true},"patched":true,"owned":{},"not_owned":["gentium","gentium-plus"],"near":[],"outcome":null},
  {"label":"Syne Italic in the registry is only near Syne","entry":{"families":[],"full":"Syne Italic","postscript":null,"trusted":false},"patched":true,"owned":{},"not_owned":["syne"],"near":["syne"],"outcome":"near"},
  {"label":"Cascadia Code PL is a patched Cascadia Code","entry":{"families":["Cascadia Code PL"],"full":null,"postscript":null,"trusted":true},"patched":true,"owned":{"cascadia-code":"patched"},"not_owned":[],"near":[],"outcome":"owned"},
  {"label":"Maple Mono NF CN is a patched Maple Mono","entry":{"families":["Maple Mono NF CN"],"full":null,"postscript":null,"trusted":true},"patched":true,"owned":{"maple-mono":"patched"},"not_owned":[],"near":[],"outcome":"owned"},
  {"label":"Inter Variable is Inter","entry":{"families":["Inter Variable"],"full":null,"postscript":null,"trusted":true},"patched":true,"owned":{"inter":"build"},"not_owned":[],"near":[],"outcome":"owned"},
  {"label":"InterVariable is Inter","entry":{"families":["InterVariable"],"full":null,"postscript":null,"trusted":true},"patched":true,"owned":{"inter":"build"},"not_owned":[],"near":[],"outcome":"owned"},
  {"label":"Inter Display is Inter","entry":{"families":["Inter Display"],"full":null,"postscript":null,"trusted":true},"patched":true,"owned":{"inter":"build"},"not_owned":[],"near":[],"outcome":"owned"},
  {"label":"Fira Code Retina is Fira Code","entry":{"families":["Fira Code Retina"],"full":null,"postscript":null,"trusted":true},"patched":true,"owned":{"fira-code":"build"},"not_owned":[],"near":[],"outcome":"owned"},
  {"label":"Source Sans 3 ExtraLight is Source Sans 3","entry":{"families":[],"full":"Source Sans 3 ExtraLight","postscript":null,"trusted":false},"patched":true,"owned":{"source-sans-3":"family"},"not_owned":[],"near":[],"outcome":"owned"},
  {"label":"Playfair Display Bold is Playfair Display, not Playfair","entry":{"families":[],"full":"Playfair Display Bold","postscript":null,"trusted":false},"patched":true,"owned":{"playfair-display":"family"},"not_owned":["playfair"],"near":[],"outcome":"owned"},
  {"label":"JetBrains Mono NL is a patched JetBrains Mono","entry":{"families":["JetBrains Mono NL"],"full":null,"postscript":null,"trusted":true},"patched":true,"owned":{"jetbrains-mono":"patched"},"not_owned":[],"near":[],"outcome":"owned"},
  {"label":"fc-list Archivo,Archivo Black owns Archivo, not Archivo Black","entry":{"families":["Archivo","Archivo Black"],"full":null,"postscript":null,"trusted":true},"patched":true,"owned":{"archivo":"family"},"not_owned":["archivo-black"],"near":[],"outcome":"owned"},
  {"label":"fc-list Archivo Black first owns Archivo Black","entry":{"families":["Archivo Black"],"full":null,"postscript":null,"trusted":true},"patched":true,"owned":{"archivo-black":"family"},"not_owned":["archivo"],"near":[],"outcome":"owned"},
  {"label":"registry Archivo Black is near both","entry":{"families":[],"full":"Archivo Black","postscript":null,"trusted":false},"patched":true,"owned":{},"not_owned":["archivo","archivo-black"],"near":["archivo","archivo-black"],"outcome":"near"},
  {"label":"registry Archivo Black Italic is near both","entry":{"families":[],"full":"Archivo Black Italic","postscript":null,"trusted":false},"patched":true,"owned":{},"not_owned":["archivo","archivo-black"],"near":["archivo","archivo-black"],"outcome":"near"},
  {"label":"registry Archivo BlackItalic is near both","entry":{"families":[],"full":"Archivo BlackItalic","postscript":null,"trusted":false},"patched":true,"owned":{},"not_owned":["archivo","archivo-black"],"near":["archivo","archivo-black"],"outcome":"near"},
  {"label":"registry Archivo Black-Regular is near both","entry":{"families":[],"full":"Archivo Black-Regular","postscript":null,"trusted":false},"patched":true,"owned":{},"not_owned":["archivo","archivo-black"],"near":["archivo","archivo-black"],"outcome":"near"},
  {"label":"registry Archivo Black-Italic is near both","entry":{"families":[],"full":"Archivo Black-Italic","postscript":null,"trusted":false},"patched":true,"owned":{},"not_owned":["archivo","archivo-black"],"near":["archivo","archivo-black"],"outcome":"near"},
  {"label":"fc-list Archivo BlackItalic first owns Archivo Black","entry":{"families":["Archivo BlackItalic"],"full":null,"postscript":null,"trusted":true},"patched":true,"owned":{"archivo-black":"family"},"not_owned":["archivo"],"near":[],"outcome":"owned"},
  {"label":"PostScript ArchivoBlack-Regular owns Archivo Black","entry":{"families":[],"full":null,"postscript":"ArchivoBlack-Regular","trusted":false},"patched":true,"owned":{"archivo-black":"family"},"not_owned":["archivo"],"near":[],"outcome":"owned"},